{

  "mdmid" : "990654099",
  "IpFlg" : true,
  "GndrCd" : "M",
  "RgnCd" : "136",
  "PrspFlg" : true,
  "StLstCrmFlg" : false,
  "TtAnnAmtNc" : 458856,
  "TtBlncAmt" : 123.45,
  "InvstPrtfAmtNc" : 765987,
  "IncmCnfAmtNc" : 5353345,
  "CntrCd" : "Russia",
  "CtprtFlg" : true,
  "VtbOnlnAcsFlg" : false,
  "PkgStrtDt" : 1729600613,
  "PkgClsDt" : 1926300395,
  "BnsCtgCd" : "Код123",
  "BnsCtgChDt" : 22443079241,
  "BnsBlncAmt" : 666555444,
  "RtSpnd30Amt" : 112233,
  "RtSpnd30Cnt" : 654456,
  "RtSpnd60Amt" : 991122,
  "RtSpnd60Cnt" : 882233,
  "RtSpnd90Amt" : 773344.45,
  "RtSpnd90Cnt" : 664455,
  "CrdDbt1MAmt" : 123,
  "CrdDbt2MAmt" : 124,
  "CrdDbt3MAmt" : 125,
  "CrdCrdt1MAmt" : 126.575,
  "CrdCrdt2MAmt" : 127,
  "CrdCrdt3MAmt" : 128,
  "CrdPrch1MAmt" : 129,
  "CrdPrch2MAmt" : 130.89,
  "CrdPrch3MAmt" : 131.56,
  "CrdTxn1MCnt" : 132.77,
  "CrdTxn2MCnt" : 133.66,
  "CrdTxn3MCnt" : 134.34,
  "VtbOnlnLstSsnDt" : 2364232300,
  "OpnFlg" : true,
  "ActCatMDMCd" : "TestString",
  "ChStLCFlg" : true,
  "CrtXzFdTpCd" : "SALARY",
  "CrtXzKkTpCd" : "1",
  "ZpBs144Flg" : false,
  "SrvcMdl" : "TestString",
  "ZFrntClntId" : 123654,
  "PackDsc" : "TestString",
  "PfmManSapId" : "TestString",
  "IntOrgGenId" : "TestString",
  "ZfrntChngCd" : "TestString"

}